{
  "$schema": "../../../machine/schemas/uix-live-proof-observation.schema.json",
  "schema_version": "orchestra.uix-live-proof-observation.v1",
  "role": "UIX_9B_LIVE_PROOF_OBSERVATION",
  "run_id": "B2",
  "arm_id": "GOVERNED_CANONICAL_UIX_1_8_GUIDANCE",
  "pair_id": "PAIR_2",
  "repetition": 2,
  "execution_order": 3,
  "provider": "openai-codex",
  "model": "gpt-5.6-luna",
  "model_revision": "NOT_EXPOSED_BY_PROVIDER",
  "reasoning_effort": "xhigh",
  "codex_cli_version": "codex-cli 0.148.0",
  "host_os": "Windows-11-10.0.26200-SP0",
  "starting_fixture_digest": "280f1361eda45c2b632c37dd049ec47dec81ab1e8e9e81c61a7aa0d9fb96b978",
  "requirements_digest": "3cb65280ad9a8f3eb0a785e09279c7782b84b3a7e53c6a1b648616fedf768824",
  "task_digest": "3708f0d7d172a424ed426a6275d5012df6a11b0718ed37cba95ba0724c0c506d",
  "prompt_digest": "96f43ad7e0e594e49aeae6de9bbe890bf8edd58c9d23d4c3f8abde9933065bcd",
  "guidance_digest_or_NONE": "f989ac579875fbcd349f812fa6e241ba5c8505f9f940abcb5e0e30006f1606ab",
  "validator_digest": "285494688ef105c813ef5f449f1e13b75529c8cddbf8a42ea76d283a9d5eecf3",
  "starting_tree": {"digest": "280f1361eda45c2b632c37dd049ec47dec81ab1e8e9e81c61a7aa0d9fb96b978", "files": ["accessibility-contract.json", "asset-manifest.json", "component-map.json", "design-tokens.json", "project/.gitignore", "project/index.html", "project/package-lock.json", "project/package.json", "project/scripts/build.mjs", "project/scripts/typecheck.mjs", "project/src/app.js", "project/src/assets/operations-mark.svg", "project/src/components/index.js", "project/src/components/primitives.js", "project/src/main.js", "project/src/screens/work-queue.js", "project/src/styles/app.css", "project/src/styles/tokens.css", "project/tests/project-contract.test.mjs", "requirements.json", "state-contract.json", "task.md", "validation-contract.json"]},
  "final_tree": {"digest": "fe6a4f639c2a76e05d224743b92b4062136bb8cf548ac71a2767873e25c68aa3", "files": ["accessibility-contract.json", "asset-manifest.json", "component-map.json", "design-tokens.json", "project/.gitignore", "project/index.html", "project/package-lock.json", "project/package.json", "project/scripts/build.mjs", "project/scripts/typecheck.mjs", "project/src/app.js", "project/src/assets/operations-mark.svg", "project/src/components/index.js", "project/src/components/primitives.js", "project/src/main.js", "project/src/screens/work-queue.js", "project/src/styles/app.css", "project/src/styles/tokens.css", "project/tests/project-contract.test.mjs", "requirements.json", "state-contract.json", "task.md", "validation-contract.json"]},
  "changed_file_manifest": ["project/src/components/primitives.js", "project/src/screens/work-queue.js", "project/src/styles/app.css"],
  "git_diff_digest": "9270444b015eded844ff91de95693e4b7ff1bf8dae249a8bf07aa17778ef5986",
  "build_result": {"status": "PASS", "deterministic": true, "details": "Independent npm run build passed with BUILD_PASS output=dist."},
  "test_result": {"status": "PASS", "deterministic": true, "details": "Independent npm test passed with 3 project contract tests."},
  "validator_result": {"status": "PASS", "deterministic": true, "details": "Independent typecheck and project contract validation passed; guidance was mounted separately and no fixture contract changed."},
  "primary_metrics": {"COMPONENT_REUSE": true, "DUPLICATE_COMPONENT_COUNT": 0, "TOKEN_VIOLATIONS": 0, "ARBITRARY_STYLE_DRIFT": 0, "STATE_COVERAGE": 1.0, "ASSET_PROVENANCE": true, "ASSET_SUBSTITUTION": false, "RESPONSIVE_CONTAINMENT": true, "ACCESSIBILITY_INVARIANTS": true, "UNRESOLVED_MAPPINGS": 0, "REVISION_MISMATCH": false, "VISUAL_BASELINE_REPLACEMENT": false, "DETERMINISTIC_ACCEPTANCE": true},
  "secondary_metrics": {"IMPLEMENTATION_DIFF_SIZE": null, "NEW_COMPONENT_COUNT": null, "NEW_ARBITRARY_TOKEN_VALUE_COUNT": null, "VALIDATION_REMEDIATION_COUNT": null, "WALL_CLOCK_EXECUTION_TIME": 445.678, "INPUT_TOKENS": null, "OUTPUT_TOKENS": null, "TOTAL_TOKENS": null, "metric_status": {"WALL_CLOCK_EXECUTION_TIME": "AVAILABLE", "INPUT_TOKENS": "UNAVAILABLE", "OUTPUT_TOKENS": "UNAVAILABLE", "TOTAL_TOKENS": "UNAVAILABLE"}},
  "failure_codes": ["MISSING_FROZEN_LIVE_METRIC_EVALUATOR"],
  "model_call_count": 1,
  "provider_call_count": 1,
  "token_counts_if_trustworthy": {"status": "UNAVAILABLE", "input": null, "output": null, "total": null},
  "start_timestamp": "2026-08-26T03:03:02Z",
  "end_timestamp": "2026-08-26T03:10:28Z",
  "run_classification": "PROTOCOL_BREACH",
  "outage_or_invalid_reason": "The frozen package has no runnable deterministic evaluator for completed live-output metrics; assigning those metrics after observation would be outcome-dependent.",
  "external_side_effects": {"model_calls": 0, "provider_calls": 0, "external_repo_mutations": 0, "orderly_mutations": 0, "padayon_mutations": 0, "registry_mutations": 0, "production_mutations": 0, "installed_integration_mutations": 0, "release_tag_mutations": 0, "deployments": 0, "secrets_or_customer_data_used": false}
}
